{
  "$schema": "https://json-schema.org/draft/2020-12/schema",
  "$comment": "Canonical runtime contract; synthetic examples are not qualification.",
  "type": "object",
  "properties": {
    "schema_version": {
      "enum": [
        5
      ],
      "type": "integer"
    },
    "mode": {
      "enum": [
        "off",
        "shadow",
        "dynamic",
        "adaptive"
      ],
      "type": "string"
    },
    "router_model": {
      "type": "string",
      "minLength": 1,
      "maxLength": 256
    },
    "key_env": {
      "type": "string",
      "minLength": 1,
      "maxLength": 256,
      "pattern": "^[A-Za-z_][A-Za-z0-9_]*$"
    },
    "timeout_ms": {
      "type": "integer",
      "minimum": 1,
      "maximum": 10000
    },
    "max_calls": {
      "type": "integer",
      "minimum": 0,
      "maximum": 100
    },
    "data_mode": {
      "enum": [
        "categories",
        "summary"
      ],
      "type": "string"
    },
    "objective": {
      "enum": [
        "latency",
        "usage",
        "cost"
      ],
      "type": "string"
    },
    "min_confidence": {
      "type": "number",
      "minimum": 0,
      "maximum": 1
    },
    "allowed_candidates": {
      "type": "array",
      "items": {
        "type": "string",
        "minLength": 1,
        "maxLength": 32,
        "pattern": "^(?!defer$)[a-z][a-z0-9_-]{0,31}$"
      },
      "uniqueItems": true,
      "maxItems": 16,
      "minItems": 0
    },
    "max_cost_usd": {
      "anyOf": [
        {
          "type": "number",
          "minimum": 0
        },
        {
          "type": "null"
        }
      ]
    },
    "max_latency_ms": {
      "anyOf": [
        {
          "type": "number",
          "minimum": 0
        },
        {
          "type": "null"
        }
      ]
    },
    "candidates": {
      "type": "array",
      "items": {
        "type": "object",
        "properties": {
          "id": {
            "type": "string",
            "minLength": 1,
            "maxLength": 32,
            "pattern": "^(?!defer$)[a-z][a-z0-9_-]{0,31}$"
          },
          "host": {
            "enum": [
              "claude-native",
              "claude-skill",
              "codex-skill"
            ],
            "type": "string"
          },
          "model": {
            "type": "string",
            "minLength": 1,
            "maxLength": 256
          },
          "effort": {
            "anyOf": [
              {
                "enum": [
                  "none",
                  "minimal",
                  "low",
                  "medium",
                  "high",
                  "xhigh",
                  "max",
                  "ultra"
                ],
                "type": "string"
              },
              {
                "type": "null"
              }
            ]
          },
          "roles": {
            "type": "array",
            "items": {
              "enum": [
                "accessibility-reviewer",
                "architecture-reviewer",
                "debug-investigator",
                "docs-writer",
                "feature-implementer",
                "fog-cartographer",
                "migration-safety-reviewer",
                "observability-reviewer",
                "ops-readiness-reviewer",
                "performance-reviewer",
                "plugin-validator",
                "pr-author",
                "prototype-builder",
                "refactorer",
                "reliability-reviewer",
                "security-reviewer",
                "test-author",
                "ui-test-author"
              ],
              "type": "string"
            },
            "uniqueItems": true,
            "maxItems": 18,
            "minItems": 1
          },
          "categories": {
            "type": "array",
            "items": {
              "enum": [
                "docs",
                "pr",
                "implementation",
                "tests",
                "debug",
                "review",
                "prototype",
                "refactor"
              ],
              "type": "string"
            },
            "uniqueItems": true,
            "maxItems": 8,
            "minItems": 1
          },
          "capabilities": {
            "type": "array",
            "items": {
              "type": "string",
              "minLength": 1,
              "maxLength": 256,
              "pattern": "^[A-Za-z][A-Za-z0-9_-]*$"
            },
            "uniqueItems": true,
            "maxItems": 16,
            "minItems": 0
          },
          "context_tokens": {
            "type": "integer",
            "minimum": 1,
            "maximum": 10000000
          },
          "quality": {
            "anyOf": [
              {
                "type": "number",
                "minimum": 0,
                "maximum": 1
              },
              {
                "type": "null"
              }
            ]
          },
          "latency_ms": {
            "anyOf": [
              {
                "type": "number",
                "minimum": 0
              },
              {
                "type": "null"
              }
            ]
          },
          "cost_usd": {
            "anyOf": [
              {
                "type": "number",
                "minimum": 0
              },
              {
                "type": "null"
              }
            ]
          },
          "usage_tokens": {
            "anyOf": [
              {
                "type": "integer",
                "minimum": 0
              },
              {
                "type": "null"
              }
            ]
          },
          "profile_revision": {
            "type": "string",
            "minLength": 1,
            "maxLength": 256
          },
          "qualification": {
            "anyOf": [
              {
                "type": "object",
                "properties": {
                  "report_hash": {
                    "type": "string",
                    "pattern": "^[0-9a-f]{64}$",
                    "minLength": 64,
                    "maxLength": 64
                  },
                  "profile_hash": {
                    "type": "string",
                    "pattern": "^[0-9a-f]{64}$",
                    "minLength": 64,
                    "maxLength": 64
                  },
                  "expires_at": {
                    "type": "number",
                    "exclusiveMinimum": 0
                  },
                  "host_revision": {
                    "type": "string",
                    "minLength": 1,
                    "maxLength": 256
                  },
                  "router_request": {
                    "type": "string",
                    "minLength": 1,
                    "maxLength": 256
                  },
                  "router_identity": {
                    "type": "string",
                    "minLength": 1,
                    "maxLength": 256
                  },
                  "roles": {
                    "type": "array",
                    "items": {
                      "enum": [
                        "accessibility-reviewer",
                        "architecture-reviewer",
                        "debug-investigator",
                        "docs-writer",
                        "feature-implementer",
                        "fog-cartographer",
                        "migration-safety-reviewer",
                        "observability-reviewer",
                        "ops-readiness-reviewer",
                        "performance-reviewer",
                        "plugin-validator",
                        "pr-author",
                        "prototype-builder",
                        "refactorer",
                        "reliability-reviewer",
                        "security-reviewer",
                        "test-author",
                        "ui-test-author"
                      ],
                      "type": "string"
                    },
                    "uniqueItems": true,
                    "maxItems": 18,
                    "minItems": 1
                  },
                  "categories": {
                    "type": "array",
                    "items": {
                      "enum": [
                        "docs",
                        "pr",
                        "implementation",
                        "tests",
                        "debug",
                        "review",
                        "prototype",
                        "refactor"
                      ],
                      "type": "string"
                    },
                    "uniqueItems": true,
                    "maxItems": 8,
                    "minItems": 1
                  },
                  "evidence_level": {
                    "enum": [
                      "configuration_verified",
                      "execution_observed"
                    ],
                    "type": "string"
                  },
                  "observed_model": {
                    "anyOf": [
                      {
                        "type": "string",
                        "minLength": 1,
                        "maxLength": 256
                      },
                      {
                        "type": "null"
                      }
                    ]
                  },
                  "observed_effort": {
                    "anyOf": [
                      {
                        "enum": [
                          "none",
                          "minimal",
                          "low",
                          "medium",
                          "high",
                          "xhigh",
                          "max",
                          "ultra"
                        ],
                        "type": "string"
                      },
                      {
                        "type": "null"
                      }
                    ]
                  },
                  "objective": {
                    "enum": [
                      "latency",
                      "usage",
                      "cost"
                    ],
                    "type": "string"
                  }
                },
                "required": [
                  "report_hash",
                  "profile_hash",
                  "expires_at",
                  "host_revision",
                  "router_request",
                  "router_identity",
                  "roles",
                  "categories",
                  "evidence_level",
                  "observed_model",
                  "observed_effort",
                  "objective"
                ],
                "additionalProperties": false
              },
              {
                "type": "null"
              }
            ]
          },
          "measurements": {
            "type": "array",
            "items": {
              "type": "object",
              "properties": {
                "role": {
                  "enum": [
                    "accessibility-reviewer",
                    "architecture-reviewer",
                    "debug-investigator",
                    "docs-writer",
                    "feature-implementer",
                    "fog-cartographer",
                    "migration-safety-reviewer",
                    "observability-reviewer",
                    "ops-readiness-reviewer",
                    "performance-reviewer",
                    "plugin-validator",
                    "pr-author",
                    "prototype-builder",
                    "refactorer",
                    "reliability-reviewer",
                    "security-reviewer",
                    "test-author",
                    "ui-test-author"
                  ],
                  "type": "string"
                },
                "category": {
                  "enum": [
                    "docs",
                    "pr",
                    "implementation",
                    "tests",
                    "debug",
                    "review",
                    "prototype",
                    "refactor"
                  ],
                  "type": "string"
                },
                "basis": {
                  "type": "string",
                  "minLength": 1,
                  "maxLength": 256
                },
                "quality": {
                  "anyOf": [
                    {
                      "type": "number",
                      "minimum": 0,
                      "maximum": 1
                    },
                    {
                      "type": "null"
                    }
                  ]
                },
                "latency_ms": {
                  "anyOf": [
                    {
                      "type": "number",
                      "minimum": 0
                    },
                    {
                      "type": "null"
                    }
                  ]
                },
                "cost_usd": {
                  "anyOf": [
                    {
                      "type": "number",
                      "minimum": 0
                    },
                    {
                      "type": "null"
                    }
                  ]
                },
                "usage_tokens": {
                  "anyOf": [
                    {
                      "type": "integer",
                      "minimum": 0
                    },
                    {
                      "type": "null"
                    }
                  ]
                }
              },
              "required": [
                "role",
                "category",
                "basis",
                "quality",
                "latency_ms",
                "cost_usd",
                "usage_tokens"
              ],
              "additionalProperties": false
            },
            "uniqueItems": true,
            "maxItems": 144,
            "minItems": 0
          }
        },
        "required": [
          "id",
          "host",
          "model",
          "effort",
          "roles",
          "categories",
          "capabilities",
          "context_tokens",
          "quality",
          "latency_ms",
          "cost_usd",
          "usage_tokens",
          "profile_revision",
          "qualification",
          "measurements"
        ],
        "additionalProperties": false
      },
      "uniqueItems": true,
      "maxItems": 16,
      "minItems": 0
    },
    "required_evidence": {
      "enum": [
        "configuration_verified",
        "execution_observed"
      ],
      "type": "string"
    },
    "routing_roles": {
      "type": "array",
      "items": {
        "enum": [
          "accessibility-reviewer",
          "architecture-reviewer",
          "debug-investigator",
          "docs-writer",
          "feature-implementer",
          "fog-cartographer",
          "migration-safety-reviewer",
          "observability-reviewer",
          "ops-readiness-reviewer",
          "performance-reviewer",
          "plugin-validator",
          "pr-author",
          "prototype-builder",
          "refactorer",
          "reliability-reviewer",
          "security-reviewer",
          "test-author",
          "ui-test-author"
        ],
        "type": "string"
      },
      "uniqueItems": true,
      "maxItems": 18,
      "minItems": 0
    },
    "catalog_revision": {
      "type": "string",
      "pattern": "^[0-9a-f]{64}$",
      "minLength": 64,
      "maxLength": 64
    },
    "outbound_contract": {
      "enum": [
        "categories-v2"
      ],
      "type": "string"
    }
  },
  "required": [
    "schema_version",
    "mode",
    "router_model",
    "key_env",
    "timeout_ms",
    "max_calls",
    "data_mode",
    "objective",
    "min_confidence",
    "allowed_candidates",
    "max_cost_usd",
    "max_latency_ms",
    "candidates",
    "required_evidence",
    "routing_roles",
    "catalog_revision",
    "outbound_contract"
  ],
  "additionalProperties": false
}
